title,authors,year,doi,type,source,abstract,openalex_id,open_access
"The Age of Anxiety: Unpacking Technological Job Insecurity and Its Impact on Workplace Innovation","Biqian Zhang, Liping Li, Min Shu et al.","2025","https://doi.org/10.5539/jms.v15n2p13","article","Journal of Management and Sustainability","As technology advances at an unprecedented pace, artificial intelligence tools like ChatGPT and Deep Seek are reshaping workplaces, sparking widespread fears of job displacement among employees. This phenomenon, termed Technological Job Insecurity (TJI), goes beyond concerns of machines replacing human roles&amp;mdash;it encompasses anxieties about being outperformed by colleagues better equipped to navigate the digital age. While innovation remains critical in such challenging times, the psychological toll of TJI often dampens employees&amp;rsquo; ability to think creatively and contribute new ideas. Drawing on Conservation of Resources (COR) Theory, this study examines how TJI erodes innovation performance by draining employees&amp;rsquo; psychological resilience and resources. We identify Self-care Self-Efficacy (SCSE)&amp;mdash;the ability to manage the impact of digital stress&amp;mdash;as a vital mechanism that mitigates this negative effect, offering pathways for resource recovery and renewed focus. Additionally, we explore how Workplace Literacy Facilitation (WLF)&amp;mdash;organizational strategies like proactive training and robust technical support&amp;mdash;buffers the impact of TJI, creating environments where employees can thrive despite technological uncertainties. Findings from diverse industries provide insights into the interplay between fear, resilience, and innovation, urging organizations to prioritize both psychological well-being and collective support in the age of automation.","https://openalex.org/W4412386762","yes"
"Intersectionality and well-being in an India-based information technology company","Anurag Shekhar, Musawenkosi D. Saurombe","2025","https://doi.org/10.4102/sajhrm.v23i0.3223","article","SA Journal of Human Resource Management","Orientation: While contemporary workplaces can foster structure, purpose and social connection, they can concurrently be a source of psychological distress. Research purpose: This research examined how specific demographic factors influence workplace well-being among employees in an India-based information technology (IT) company. Motivation for the study: Despite growing global interest in workplace well-being, evidence from non-Western contexts remains limited. Research approach/design and method: Adopting an explanatory sequential mixed-methods design, the research integrated a cross-sectional survey (n = 109) with two focus group discussions (n = 15) and five interviews (n = 5) to explore experiences of well-being, engagement and perceived stress. Main findings: Five constructs were quantitatively assessed: mental well-being, life satisfaction, flourishing, work engagement and perceived stress. Among 20 hypotheses tested, 2 yielded statistically significant results: life satisfaction was significantly higher among high-income employees (p = 0.011) and perceived stress differed across generational cohorts (p = 0.043), with younger employees reporting more stress. Qualitative data revealed how job demands, social identities and technostress shaped well-being experiences. Younger participants described heightened stress linked to isolation, urban commuting and reduced social interaction after transitioning from college to corporate life. Practical/managerial implications: The findings highlight the need for culturally sensitive and demographically responsive well-being interventions in fast-evolving work environments. Contribution/value-add: This research contributes to Global South scholarship on workplace mental well-being by showing that intersectional demographic factors significantly shape well-being outcomes.","https://openalex.org/W4415735356","yes"
"AI-Driven Workforce Productivity in Developing Economies","Zhang Weiyu, Shunli Qiu, Guido Max Mantovani et al.","2025","https://doi.org/10.4018/jgim.390793","article","Journal of Global Information Management","This study investigates the impact of Artificial Intelligence Implementation (AII) on Employee Engagement (EE) and Employee Performance (EP), examines the Organizational Agility (OA)'s moderating role in China's manufacturing sector's Information Technology integration. Data was collected from major manufacturing provinces: Zhejiang, Shandong, Jiangsu, Guangdong, and Henan (N = 899), covering biomedicines, renewable energy products, textiles, automobiles, and electronics. The structural equation modelling results reveal that AIA significantly enhances EP directly and indirectly through EE. OA positively moderates the relationship between AIA and EE, highlighting that greater agility organizations are more effective in turning AI-driven Information Technology initiatives into higher employee engagement. The moderation effect is evidenced by a steeper slope in the interaction plot under high OA conditions. This study enriches the AI and IT-driven transformation theory in human resource management practices and offers practical insights for manufacturing leaders.","https://openalex.org/W4415300377","yes"
"Components of Transformational and Transactional Leadership: Predicting Academic Performance Beyond and Below Expectations","John Garger, Paul H. Jacques, Veselina Vracheva et al.","2023","https://doi.org/10.21818/001c.90586","article","Journal of Behavioral and Applied Management","This study investigates the combined effects of transformational and transactional leadership on higher-education students’ performance both beyond and below students’ historic scholastic achievement. Instructors’ intellectual stimulation behaviors, a component of transformational leadership, and their preemptive corrective oversight in the form of management by exception active, a component of transactional leadership, are correlated with grades students earned in a course. Findings suggest that beyond a student’s near-past academic performance, an instructor’s transformational and transactional behaviors influence a student’s performance in a class either positively or negatively, respectively. Instructors’ transformational and transactional leader behaviors also had opposing effects on grades after controlling for near-past academic performance. These findings underscore the need for instructors to engage in a combination of transformational and transactional leadership behaviors to support students’ pursuit of high academic achievement.","https://openalex.org/W4389017556","yes"
"Psychosocial Work Environment and Learning Opportunities in Remote Work – A hermeneutical study about managers´ and employees´ experiences","Lina Holmbeck","2021","","article","Lund University Publications Student Papers (Lund University)","Remote work is becoming more and more common among employees on today´s labour market. Previous research show that remote work both have positive and negative effects on the psychosocial work environment and learning opportunities. This study aims to generate deeper knowledge of how managers and employees are affected by and deal with remote work in relation to the psychosocial work environment and learning opportunities. The focus has been on the leader-member relationship, the work situation and learning opportunities. The investigation has been conducted from a hermeneutical perspective and with an abductive approach. To collect data, semi-structured interviews with participants at Tetra Pak have been done. The result of the study shows that remote work leads to decreased social and informal interactions which seem to influence the leader-member relationship, the feeling of belongingness, cooperation, and informal learning. It appears that it is particularly important to support and motivate employees in these new conditions and establishing a clear communication strategy as well as strong relationships. Also, some employees tend to work more when doing remote work, thus, managers must reconcile the workload of employees regularly. Future research could investigate how digital tools can be utilised in remote work to create social cohesiveness and informal learning.","https://openalex.org/W3174776231","yes"
"Examining the Role of Technostress Creators and Inhibitors on Academics Burnout","Kamarul Faizal Hashim, Felix B. Tan, Ammar Rashid et al.","2024","https://doi.org/10.28991/esj-2024-sied1-012","article","Emerging Science Journal","Recent studies have focused on examining the impact of technostress (TS) on academics and students. However, there remains a paucity of studies examining the influence of TS on burnout among academics. This study aims to explore the influence of TS on academics' feelings of burnout and to examine the mitigating role of TS inhibitors on burnout among academics when using online learning technology. A web-based survey was designed and used to collect data from 115 academics in Malaysian universities. The data were analyzed using the Partial Least Squares Structural Equation Modeling (PLS-SEM) technique. The research findings reveal that academic burnout is significantly influenced by technology insecurity, technology invasion, and technology uncertainty. However, the impact of technology overload is only partially significant, while technology complexity does not exert a significant influence on academic burnout. Moderation tests reveal that literacy and involvement facilitation significantly moderate the relationship between technology uncertainty and insecurity, reducing burnout feelings. This study extends existing literature by providing empirical evidence to explain the relationship between TS and the academic burnout construct. Furthermore, it demonstrates the mitigating role of TS inhibitors on the burnout construct. Additionally, it offers potential strategies for alleviating burnout among academics, particularly in Malaysian university contexts. Doi: 10.28991/ESJ-2024-SIED1-012 Full Text: PDF","https://openalex.org/W4401077513","yes"
"Digital Detox Policies: Leadership Strategies for a Hyperconnected World","Megren Abdullah Altassan","2025","https://doi.org/10.37394/232015.2025.21.31","article","WSEAS TRANSACTIONS ON ENVIRONMENT AND DEVELOPMENT","The paper discusses how digital detox policies can help manage hyper-connectivity challenges in workplaces, focusing on organizations in Jeddah, Saudi Arabia. This quantitative study evaluates the perceptions of employees and leaders, identifies the challenges and benefits of digital detox strategies, and explores leadership practices that promote successful implementation. The findings show that digital detox policies enhance employee well-being, lower stress and burnout, and improve work-life balance, thereby boosting organizational performance. Effective leadership practices include modeling healthy digital behaviors, setting technology usage boundaries, and involving employees in policy design. However, barriers such as resistance to change, communication gaps, and cultural factors affect policy acceptance. Implications for leaders and policymakers emphasize the need for tailored strategies, leadership development, and regulatory support to institutionalize digital detox initiatives. Future research should explore the long-term effects of these policies and their adaptability to emerging technologies.","https://openalex.org/W4410245365","yes"
"RETRACTED ARTICLE: Connecting Human and Information Resources in the Generation of Competitive Advantage","Sergio Camisón-Haba, José Antonio Clemente‐Almendros, Tomás Gonzalez-Cruz","2024","https://doi.org/10.1007/s13132-024-01907-y","article","Journal of the Knowledge Economy","Abstract A key trend in recent decades is a growing standardisation of tangible digital resources. This trend coexists with development in the most advanced organisations of high-level technological, human and organisational resources teams built around advanced digital solutions. Digitisation has increased information asymmetries in organisations. However, it has changed the nature of the assets that support them. Accordingly, their effects are independent if unaccompanied by complementary investments in organisational design and human capital. This article focuses on relationships between information and cognitive asymmetries, their effects on developing strategic capabilities and their impact on competitive position. Partial least squares structural equation modelling (PLS-SEM) analysis was run on a data set of 418 Spanish tourism firms. The results show the positive effects of the interaction between human resources and information assets in strengthening the competitive position of modern organisations.","https://openalex.org/W4392948720","yes"
"For What It’s Worth: Humans Overwrite Their Economic Self-interest to Avoid Bargaining With AI Systems","Alexander Erlei, Richeek Das, Lukas Meub et al.","2022","https://doi.org/10.1145/3491102.3517734","article","CHI Conference on Human Factors in Computing Systems","As algorithms are increasingly augmenting and substituting human decision-making, understanding how the introduction of computational agents changes the fundamentals of human behavior becomes vital. This pertains to not only users, but also those parties who face the consequences of an algorithmic decision. In a controlled experiment with 480 participants, we exploit an extended version of two-player ultimatum bargaining where responders choose to bargain with either another human, another human with an AI decision aid or an autonomous AI-system acting on behalf of a passive human proposer. Our results show strong responder preferences against the algorithm, as most responders opt for a human opponent and demand higher compensation to reach a contract with autonomous agents. To map these preferences to economic expectations, we elicit incentivized subject beliefs about their opponent's behavior. The majority of responders maximize their expected value when this is line with approaching the human proposer. In contrast, responders predicting income maximization for the autonomous AI-system overwhelmingly override economic self-interest to avoid the algorithm.","https://openalex.org/W4225006930","yes"
"Workplace digital transformation: Impact of employees’ autonomy and relatedness to employees’ intention actively support digital transformation","Dila Maghrifani, Adennia Oktaviana Fadli, Aref Mahdavi Ardekani","2022","https://doi.org/10.20961/smbr.v7i2.73472","article","Sebelas Maret Business Review","The existence of the Covid-19 pandemic has significantly changed the world order to become completely digital. Therefore it is necessary to have the desire to continue to change with the times, whether for each individual or the company. Before carrying out digital transformation in the workplace, companies need to think about how their employees can actively support digital transformation. This research examines several factors, such as autonomy, relatedness, and performance, in actively fostering employee intentions to support digital transformation in the workplace. Using the cross-sectional method, there were 95 respondents from employees in the banking sector in Surakarta and its surroundings. In general, this study found that autonomy, relatedness, and performance can increase employee intention to support digital transformation in the workplace. This research is expected to provide insights for companies to examine what factors are needed to prepare for workplace digital transformation. In addition, this research is also expected to add to the literature for up-to-date research on digital transformation in Indonesia.","https://openalex.org/W4376615077","yes"
"The Role of TAM as a Mediator between Organizational Support and Technostress of ASN Employees","Dian Dwi Nur Rahmah, Netty Dyan Prastika, Reza Wardhana et al.","2025","https://doi.org/10.35134/jpsy165.v18i3.596","article","Psyche 165 Journal","The SIKAP IDAMAN application as a digital innovation in civil service management, providing access to daily performance reports (LKH), performance data, and employee discipline mapping. However, its implementation has presented psychological challenges, particularly technostress among employees. This study aims to explore the influence of perceived organizational support and technology acceptance on technostress among civil servants in the Kutai Kartanegara Regency Government. A quantitative approach was employed, involving 36 employees from the Inspectorate Office who actively use the SIKAP IDAMAN application. Mediation analysis was conducted using JASP software version 0.14.1.0 to examine the relationships between variables. The results show that perceived organizational support significantly influences technostress through technology acceptance (p = 0.036). Perceived organizational support also has a direct negative effect on technostress (p = 0.000) with a path coefficient of -0.281 (low category, f² = 0.111). Furthermore, organizational support significantly influences technology acceptance (p = 0.000) with a path coefficient of 0.849 (high category, f² = 2.584). Technology acceptance also negatively affects technostress (p = 0.031) with a path coefficient of -0.448 (moderate category, f² = 0.154). These findings highlight the importance of technology acceptance as a mediating factor in reducing technostress, and emphasize the critical role of organizational support in facilitating successful technology adaptation among civil servants. Keywords: technostress, perceived organizational support, technology acceptance","https://openalex.org/W7125364252","yes"
"Digital Learning Orientation and Entrepreneurial Competencies in Graduates: Is Blended Learning Sustainable?","Mir Shahid Satar, Sager Alharthi, Fandi Omeish et al.","2024","https://doi.org/10.3390/su16177794","article","Sustainability","The emerging literature demonstrates the significance of digital learning in developing sustainable employability skills in learners. In the modern scenario of digitally transforming business and entrepreneurship education (EE), the study examines the role of digital learning orientation (DLO) for the development of entrepreneurial competencies (ECs) in graduates while considering the effects of blended learning (BL) behavior. The study data came from a survey of 317 graduate students in Saudi Arabia, where digitalization and entrepreneurship are positioned as new agendas for sustainable development in the education sector. The data analysis results from partial least squares structural equation modelling (SmartPLS 3.0) revealed that DLO has a direct impact on the development of ECs in graduates. However, the effects of BL on ECs were not proven. Nevertheless, BL was found to moderate the relationship between DLO and ECs. As a result, the study produced new theoretical and practical implications underpinning digital learning and EE in the contemporary digitalization context.","https://openalex.org/W4402305994","yes"
"Leadership and Followers’ Innovative Work Behavior Relationship Research: Connecting the Dots Using Systematic Bibliometrics","Sabzar Ahmad Peerzadah","2024","https://doi.org/10.24840/2183-0606_012.003_0006","article","Journal of Innovation Management","Empirical research established that leadership is a critical determinant of followers' innovative work behavior, and has reached a sufficient level of maturity to warrant a comprehensive review. However, the existing reviews frequently examined leadership and followers’ innovative work behavior (IWB) separately, resulting in a distorted picture of the development and relevance of their joint contribution. To address this gap, the paper aims to review the studiesexamining the relationships between leadership and IWB through a hybrid review. Hence, bibliometric analysis and systematic review were conducted to understand the phenomenon. The data analysis included performance analysis and science mapping by employing VOSviewer and bibliometrix, alongside content analysis of studies obtained from the Scopus database covering the period from 2008 to 2021. Results revealed that transformational leadership was most studied, followed by empowering, inclusive, and servant leadership. Most studies employ social exchange and social cognitive theory. The majority of the studies adopted a quantitative cross-sectional research design. The research examined the mediators and moderators utilized to explore the relationship between leadership and IWB and discovered variations in the empirical results. The prospects for future research are shown in terms of constructs, theoretical lenses, and methodologies.","https://openalex.org/W4405794430","yes"
"Personalized AI for workplace health promotion: performance management and healthcare worker engagement through digital analytics","Daniele Virgillito, Caterina Ledda","2026","https://doi.org/10.3389/fpubh.2025.1718474","article","Frontiers in Public Health","Background: Artificial intelligence (AI) is increasingly being applied in healthcare work-places to promote worker wellbeing and optimize organizational performance. However, evidence on its effectiveness, adoption, and limitations remains fragmented. This scoping review aimed to systematically map the literature on AI-based digital technologies for workplace health promotion and performance management among healthcare workers. Methods: The review was reported in accordance with PRISMA-ScR guidelines and was conducted up to July 2025. Studies were screened and selected using the PCC (Population-Concept-Context) framework, and data were extracted on AI technology type, health promotion focus, and outcomes. Electronic searches were conducted in PubMed, Scopus, Web of Science, PsycINFO, IEEE Xplore, and Google Scholar. The search identified 351 records; after removing duplicates and non-eligible papers, 180 records were screened, 84 full texts assessed, and 21 studies included in the final synthesis. Results: Twenty-one studies were included, covering quantitative, qualitative, and mixed-method designs. Two major domains of application emerged: AI-enabled health monitoring and intervention and AI-driven performance optimization. Reported benefits included reductions in stress, burnout, anxiety, and musculoskeletal pain, as well as improvements in workflow efficiency, documentation quality, leadership support, and staff engagement. However, limitations included short study durations, methodological heterogeneity, privacy and ethical concerns, and variable adoption by healthcare staff. Conclusions: AI-based digital technologies show promise for enhancing both worker health and organizational sustainability. To ensure long-term impact, future research should prioritize rigorous study designs, standardized outcome measures, privacy-preserving frameworks, and human-centered approaches to technology integration.","https://openalex.org/W7123350338","yes"
"Systematic Literature Review: Affective Experiences as a Predictor of Counterproductive Work Behaviour","Nor Hafizah Ibrahim, Zafir Khan Mohamed Makhbul, Abu Hanifah Ayob et al.","2023","https://doi.org/10.26668/businessreview/2023.v8i3.1191","article","International Journal of Professional Business Review","Purpose: This study aims to systematically review the literature on counterproductive work behaviour (CWB) to understand better the role of affective experiences in predicting such behaviour. Theoretical framework: Since CWB can have devastating effects on both individuals and organisations, there has been rising concern about the issue. Meanwhile, recent studies have demonstrated the substantial influence of affective experiences on CWB. Therefore, it’s common to view such experiences as immediate causes of CWB in the workplace. However, a lack of research has systematically examined this relationship. Design/methodology/approach: This study follows PRISMA (Preferred Reporting Items for Systematic reviews and Meta-Analyses) guidelines by integrating multiple research designs from 2017 to 2022 to investigate the phenomenon of affective experiences-CWB. The relevant literature review was selected from two (2) established databases, Scopus and Web of Science. Findings: Thematic analysis yielded three (3) overarching themes as predictors of affective states at work: unpleasant treatment/attitudes of others, job stressors, and dispositional distribution. Affective states that predict CWB were also identified, with two (2) primary themes (broad negative and positive affect) and seven (7) sub-themes (discrete negative and positive emotions). Furthermore, two (2) major themes, internal and external mechanisms, appear to be underlying mechanisms in the relationship between affective experiences and CWB. Research, Practical &amp; Social implications: This study offers valuable insight into the state of knowledge and practical implementation for future strategies. Originality/value: This work may be the first study to systematically review the literature on the topic of CWB from an affective experience perspective. The work contributes to the existing literature on affective experience-CWB in two (2) major ways. First, the study provides a more in-depth explanation of the predictors, implications, and underlying mechanisms, of the relationship between affective experiences and CWB by thoroughly reviewing the relevant empirical studies. Second, it identifies important research gaps and recommends a path forward for future studies in this field.","https://openalex.org/W4375932480","yes"
