title,authors,year,doi,type,source,abstract,openalex_id,open_access
"Digitalization as a Challenge to Sustainable Work: Sources of Deteriorating Working Conditions in Central Europe","Magdalena Tusińska, Izabela Ostoj, Joanna Trzęsiok et al.","2026","https://doi.org/10.3390/su18062929","article","Sustainability","While the digital transformation is predominantly framed as a catalyst for efficiency, the structural shifts induced by digitalization seem to generate a hidden erosion of working conditions that challenges the broader vision of sustainable work. Focusing on four Central European countries, this research explores how contemporary labor environments conceal declines in job quality. Drawing on original survey data, the study identifies several critical sources of this deterioration, including uncompensated workload expansion, the erosion of the right to disconnect, and the increasing pressure of digital presenteeism. The analysis reveals that these hidden shifts are most prevalent among workers in remote or hybrid models, as well as those in the first decade of their professional careers. Younger workers appear especially vulnerable to the blurring of work–life boundaries and the compulsion to maintain availability during illness. The research questions were addressed using appropriate statistical tests and by constructing working conditions due to digitalization index (WCDI). These findings point toward a need for a broader understanding of how digital transformation impacts the sustainability of work in practice.","https://openalex.org/W7137810892","yes"
"Moderating Role of Tri Hita Karana on Work Systems, Engagement, and Turnover Intention in Bali Hospitals","Anak Agung Media Martadiani, Made Setini, Daru Asih et al.","2026","https://doi.org/10.32535/ijabim.v11i1.4348","article","International Journal of Applied Business and International Management","High nurses’ turnover intention remains a critical issue in healthcare organizations, affecting service quality and organizational sustainability. This study aims to examine the effect of High-Performance Work Systems (HPWS) and employee engagement (EE) on turnover intention (TOI), with Tri Hita Karana (THK) as a moderating variable. This study employs a quantitative approach using data collected from 150 nurses working in private hospitals in Denpasar. The data were analyzed using Partial Least Squares–Structural Equation Modeling (PLS-SEM). The results indicate that HPWS has a significant negative effect on TOI (β = -0.45, p = 0.001), and EE also shows a significant negative effect (β = -0.50, p = &lt; 0.001), suggesting that effective HR practices and higher EE reduce employees’ intention to leave. In addition, THK has a significant negative direct effect on TOI (β = -0.30, p = 0.006) and strengthens the relationships between HPWS and TOI as well as between EE and TOI. These findings highlight the importance of integrating HR practices, psychological engagement, and cultural values in reducing turnover intention. This study contributes to the human resource management literature by incorporating local cultural values into employee retention and offers practical implications for developing culturally aligned retention strategies in healthcare","https://openalex.org/W7154948223","yes"
"HRM Unleashed: Modelling Employee Engagement Through the Mediating Lens of Job Satisfaction with SEM","K. Gouthami, S. Srilalitha G Kumari, Thejasvi Sheshadri et al.","2025","https://doi.org/10.51983/ijiss-2026.16.1.24","article","Indian Journal of Information Sources and Services","Examining the dynamic link between employee engagement, job satisfaction, and organizational results using Structural Equation Modelling (SEM) is the subject of this study. This research uses Cronbach's alpha, composite reliability, and confirmatory factor analysis to assess the validity and reliability of the construct measures. The respondents come from a wide range of backgrounds. The findings demonstrate a high degree of validity and internal consistency at the dimension level. Organizational outcome, employee engagement, and work satisfaction are all significantly correlated, according to SEM results. By acting as a mediator between engagement and results, work satisfaction plays a pivotal role in the creation of organizational performance, according to the mediation study. The amount of explained variance (R-squared) and effect sizes provide evidence of good model fit, especially when it comes to the prediction of productivity and organizational citizenship behavior. The model also has an out-of-sample predictive power in PLS Predict analysis. In sum, the study gives us a strategic idea of the need to generate participatory and satisfaction levels as a means of ensuring excellence in terms of organizational results and offers programs that HR managers and policy-behaviorists can use in order to enhance the effectiveness of the workforce and their retention.","https://openalex.org/W7117235838","yes"
"Psychological Empowerment and Performance of Millennials and Generation Z Employees in the IT Sector: Mediating Role of Affective Commitment","Anjali Chapagain, Ujjwal Bhattarai, Baburam Timsina et al.","2025","https://doi.org/10.3126/qjmss.v7i2.87785","article","Quest Journal of Management and Social Sciences","Background: In today's technologically advanced and competitive workplace, employee performance has grown more important, particularly as Gen Z and millennials change workplace expectations with stronger desires for autonomy, flexibility, and meaningful work. Understanding how psychological empowerment enhances performance and emotional commitment among younger workforce cohorts is crucial for improving motivation, retention, and long-term organizational sustainability in the rapidly expanding IT sector. Purpose: This study examines the influence of psychological empowerment dimensions (meaning, competence, self-determination, and impact) on the performance of millennials and Gen Z employees in Nepal's IT sector, and how affective commitment mediates these relationships within the dual theoretical perspectives of self-determination and social exchange theories. Design/methodology/approach: Purposively, cross-sectional data were collected from 270 millennials and Gen Z employees involved in technical roles and remote work roles. The structural path was examined using SmartPLS 4.0v. Findings: The descriptive findings demonstrated moderate levels of empowerment and intrinsic motivators as key drivers of performance and emotional attachment in digitally enabled work settings. All the dimensions of psychological empowerment showed significant influence on employee performance, with impact emerging as the most dominant factor and self-determination exerting the least influence. Similarly, affective commitment mediated the relationship between all four dimensions of psychological empowerment and performance. Conclusion: The findings highlight that psychological empowerment serves as a psycho-relational process that converts intrinsic motivation into affective reciprocity, providing multi-level implications for promoting an empowered, emotionally resilient, and high-performing workforce. This study highlights the significance of employees feeling psychologically empowered and emotionally connected in fostering long-term relationships with the organization. Keywords: Affective commitment, employee performance, Generation Z, Millennials, psychological empowerment","https://openalex.org/W7117419926","yes"
"New psychometric evidence of the labor commitment scale in Peruvian teachers","Manuel Amasifuen-Reategui, José Joel Cruz-Tarrillo","2025","https://doi.org/10.3389/feduc.2025.1693137","article","Frontiers in Education","We live in a highly competitive environment where work commitment has a crucial advantage within educational organizations, given its direct link to performance, productivity, and employee well-being. This study aims to validate the ESCOLA work commitment scale in Peruvian secondary school teachers. The study was approached from an instrumental methodology, applying the survey to 598 teachers in public secondary schools in Peru. Descriptive analyses, scale statistics, and confirmatory factor analysis were performed to determine the structure of the construct. The results indicate that the ECSOLA maintains a reliability in each of its items; its Cronbach’s index ranges between 0.804 and 0.825, whose indices (CFI = 0.927, TLI = 0.901, and RMSEA = 0.076) indicate an adequate adjustment and a one-dimensional scale of 10 items valid to be applied in this context. In conclusion, the findings support the applicability of the scale in the Peruvian educational field, providing a reliable tool to measure teacher engagement and facilitating research on well-being and performance in the educational context.","https://openalex.org/W4415652119","yes"
"How does external knowledge integration influence SME employee creativity in the digital age?","Yue Zhang, Javier Aguilera-Caracuel, Yuxiang Hong","2026","https://doi.org/10.1108/ijoem-05-2024-0849","article","International Journal of Emerging Markets","Purpose This study aims to enrich social information processing theory (SIP) by investigating how external knowledge integration (EKI) influences Chinese small and medium-sized enterprises (SMEs) employee creativity through creative process engagement (CPE) and work-related exhaustion in the digital age. Additionally, we investigate the moderating role of leader encouragement in the mediational pathway from EKI to employee creativity. Design/methodology/approach Using a two-wave longitudinal survey with data collected from 212 employees selected from 143 SMEs across various industries in eastern China, we tested our hypothesis using multivariate regression models with bootstrap procedures. Findings This research found that EKI has both positive and negative effects on employee creativity, mediated by CPE and work-related exhaustion, respectively. Additionally, leader encouragement of creativity moderates the impact of EKI on CPE and work-related exhaustion, influencing how the positive and negative effects of EKI affect creativity in the digital age. Originality/value This paper applies SIP theory to examine the complex relationship between EKI, CPE, work-related exhaustion, and the role of leaders in SMEs. Our study offers practical implications for SME leaders to leverage external knowledge to improve employee creativity.","https://openalex.org/W7124423266","yes"
"Optimising Leadership Performance in Open Online Flexible Distance Learning Higher Education Institutions Amidst the Digital Transformation","Zahir Osman, Ahmad Izanee Awang, Thirumeni Subramaniam","2025","https://doi.org/10.6007/ijarbss/v15-i5/25136","article","International Journal of Academic Research in Business and Social Sciences","The importance of leadership performance in open online distance learning cannot be overstated, as effective leadership is crucial for driving institutional success, fostering a positive learning environment, and ensuring the delivery of high-quality education to students in a rapidly evolving digital landscape.This study assesses the direct and indirect relationships between a leader's engagement, leadership style, and adaptability with a leader's performance and self-efficacy as a mediator in open online distance learning higher education institutions.Methodologically, the study comprehensively evaluates the impact of leaders' engagement, leadership style, adaptability, and performance, with leaders' self-efficacy as a mediator, through primary data collection via surveys.The survey questionnaires were distributed via email using purposive sampling, yielding a satisfactory response rate.Out of 472 surveys distributed, 361 were collected, and 342 clean data and were used in the analysis.Structural equation modeling (SEM) was employed for data analysis, utilizing Smartpls4 software.The results revealed that all the hypotheses are supported except for the direct relationship between a leader's engagement and a leader's performance, which is not supported.The findings contribute theoretically by aligning with Social Cognitive Theory (SCT), emphasizing the importance of self-efficacy beliefs and observational learning in shaping leadership behaviors and outcomes.Practically, the study suggests investment in leadership development programs, promotion of collaborative leadership practices, and support for adaptive leadership approaches to enhance leader effectiveness.Future studies could explore contextual factors, longitudinal effects, and comparative analyses to advance our understanding of leadership in online learning environments.Additionally, qualitative methods and interdisciplinary approaches could provide deeper insights into the complex dynamics of leadership in open online distance learning higher education institutions.","https://openalex.org/W4410374592","yes"
"Aile ve Denge: Havayolu Kabin Memurlarında İş Yaşam Dengesi, Teknostres ve Kariyer Stresi İlişkisi","Mustafa Altıntaş, Burcu Altıntaş","2026","https://doi.org/10.31592/aeusbed.1815578","article","Ahi Evran Üniversitesi Sosyal Bilimler Enstitüsü Dergisi","Bu çalışmada, havayolu kabin memurlarında teknostres–kariyer stresi–iş-yaşam dengesi ilişkisi bütüncül bir model çerçevesinde incelenmiştir. Araştırma modeli Talep–Kontrol Yaklaşımı ve İş–Aile Sınırları Kuramı temelinde kurgulanmış; teknostresin kariyer stresi ve iş-yaşam dengesi üzerindeki doğrudan etkileri ile kariyer stresi üzerinden dolaylı etkisi eşzamanlı olarak test edilmiştir. Veriler, Türkiye’de sivil havayolu işletmelerinde görev yapan 425 kabin memurundan çevrimiçi anketle toplanmıştır. İş-yaşam dengesi, kariyer stresi ve teknostres düzeyleri geçerliği ve güvenirliği kanıtlanmış ölçeklerle ölçülmüş; AFA/DFA ile ölçüm modelleri doğrulandıktan sonra SPSS/AMOS ve PROCESS Macro Model 4 kullanılarak korelasyon ve aracılık analizleri gerçekleştirilmiştir. Bulgular, teknostresin kariyer stresini artırdığını; kariyer stresinin iş-yaşam dengesini zayıflattığını; teknostresin iş-yaşam dengesini ayrıca doğrudan olumsuz etkilediğini ve bu ilişkide kariyer stresinin kısmi aracılık rolü üstlendiğini göstermektedir. Sonuçlar, dijital taleplerin kontrol algısını zayıflatarak “yüksek gerilimli iş” koşulları yarattığını ve sınır geçirgenliğini artırarak psikolojik ayrılmayı güçleştirdiğini desteklemektedir. Bulgular doğrultusunda, bildirim/erişim sınırları, kullanıcı dostu sistem tasarımları, yeterlik geliştirme ve teknik destek programları gibi müdahalelere yönelik yönetsel öneriler sunulmuştur.","https://openalex.org/W7132828254","yes"
"Enhancing Lecturer Productivity Through Work-Life Balance and Organizational Commitment: The Moderating Role of Information Technology in Islamic Universities","Ahmad Yani, Suharno Pawirosumarto, Muhammad Ridwan","2026","https://doi.org/10.38035/dijemss.v7i4.6413","article","Dinasti International Journal of Education Management And Social Science","Lecturer productivity is a strategic priority for Islamic Higher Education Institutions (IHEIs), which combine academic excellence with Islamic values and community service while often operating under constraints such as limited digital infrastructure, heavy administrative workloads, and dual religious–academic responsibilities. This study examines how organizational commitment and work-life balance influence lecturer productivity in six IHEIs in Jambi Province, with information technology (IT) tested as a moderating factor. Using a quantitative survey of 237 lecturers and analyzing the data with SEM-PLS, the results show that organizational commitment significantly improves lecturer productivity, whereas work-life balance has a positive but statistically insignificant effect. IT demonstrates a strong direct impact on productivity, but it does not moderate the effects of organizational commitment or work-life balance, suggesting that technology operates primarily as a general performance enabler rather than a conditional amplifier of these individual factors. These findings extend evidence on productivity determinants in the under-studied IHEI context and offer practical implications for policy and management, particularly the need to strengthen digital infrastructure, enhance organizational support systems, and align HR practices with the institutional realities of Islamic higher education.","https://openalex.org/W7161976421","yes"
"Colleagues’ Support and Techno-Complexity: The Importance of a Positive Aging Climate","Teresa Galanti, Stefania Fantinelli, Veronica Giffi et al.","2024","https://doi.org/10.28945/5383","article","Informing Science The International Journal of an Emerging Transdiscipline","Aim/Purpose: With a focus on promoting sustainable career paths, this article investigates the intricate relationship between age diversity management and techno-complexity, emphasizing the pivotal role of a supportive work environment. Background: In the modern workplace, the dynamics of age diversity emerge as a crucial element influencing the well-being and productivity of employees, particularly amidst the swiftly evolving digital landscape. This becomes especially pertinent when considering workers’ unique challenges adapting to technological advancements. Methodology: Utilizing a cross-sectional design, data were collected from 160 employees in an Italian multinational company within the metalworking sector. Contribution: This study provides valuable insights into the complex dynamics between the aging climate, colleagues’ support, and techno-complexity. It emphasized the importance of considering the direct effects of organizational factors and their in-direct influences through social dynamics and support structures within the workplace. Findings: The results revealed the mediating role of colleagues’ support in the relationship between the aging climate and techno-complexity. These findings highlight the importance of a supportive work environment in the context of sustainable career development, contributing to a comprehensive understanding of diversity management within the modern digital era. Recommendation for Researchers: Our results open to a series of implications and future directions. First, the unexpected finding regarding the direct relationship between the aging climate and technostress calls for a deeper exploration of the intricacies involved. Future studies could delve into specific organizational contexts, technological demands, and individual differences that may modulate this relationship. Future Research: Future studies could delve into specific organizational contexts, technological demands, and individual differences that may modulate this relationship.","https://openalex.org/W4403576498","yes"
"Leadership Styles of Middle Managers in a Higher Education Institution in Laguna, Philippines","Charmyne De Vera Sanglay","2025","https://doi.org/10.62225/2583049x.2025.5.5.5124","article","International Journal of Advanced Multidisciplinary Research and Studies","This study aimed to explore and assess the leadership styles of middle managers in Higher Education Institutions (HEIs) in Laguna. A descriptive research design was utilized, employing the Multifactor Leadership Questionnaire (MLQ5) to collect data from 75 faculty members. The MLQ5 survey, consisting of 45 questions, assessed transformational, transactional, and laissez-faire leadership styles using a Likert scale. Quantitative data were analyzed using descriptive statistics to identify the prevalence of different leadership styles and understand faculty perceptions, with results categorized according to the three leadership styles. Findings indicate a predominantly middle-aged, highly educated workforce, with a gender distribution favoring females. Most respondents are employed full-time, suggesting a stable employment structure. Transformational leadership is the predominant style perceived by faculty, with idealized behaviors (3.87, fairly often) and inspirational motivation (3.21, fairly often) rated highly, suggesting leaders as role models who inspire enthusiasm and vision. Other transformational components like idealized attributes (2.79, sometimes), intellectual stimulation (2.22, sometimes), and individual consideration (2.97, sometimes) scored lower, indicating areas for improvement. Transactional leadership, particularly contingent reward (3.13, fairly often), also plays a significant role, while management-by-exception: active (2.06, sometimes) is less frequently observed. Passive-avoidant behaviors such as management-by-exception: passive (1.46, once in a while) and laissez-faire (1.21, once in a while) are infrequent, reflecting effective leadership practices. Leadership outcomes reveal that faculty perceive extra effort (2.43, sometimes) and effectiveness (3.14, fairly often) moderately, with overall satisfaction (3.18, fairly often) indicating general effectiveness but highlighting opportunities for enhancement. Recommendations include prioritizing transformational leadership skills enhancement, integrating transactional leadership into development programs, seeking feedback from faculty and conducting regular assessments of leadership effectiveness. In conclusion, the study highlights the importance of transformational and transactional leadership in HEIs, recommending strategies to enhance leadership effectiveness and institutional success.","https://openalex.org/W4415955327","yes"
"ANTECEDENT ANALYSIS OF JOB SATISFACTION IN THE HOSPITALITY INDUSTRY SECTOR IN BATAM CITY","Ridhayati Farid, Jonathan Jonathan, Siti Rohani","2025","https://doi.org/10.35508/jom.v18i3.26071","article","Journal of Management Small and Medium Enterprises (SMEs)","This study analyzes factors influencing the job satisfaction of hotel employees in the tourism sector, focusing on innovation and employees’ active role in shaping their work environment. The study involves employees of 1- to 3-star hotels in Batam City, with 352 respondents selected through probability sampling. Data were collected through a 33-item Google Form questionnaire and analyzed using the PLS method with SmartPLS 4.0. The results show that job crafting and innovative work behavior do not directly affect job satisfaction but influence organizational support and employee engagement. Organizational support and employee engagement significantly affect job satisfaction and act as mediators in the relationship between job crafting and innovative work behavior with job satisfaction. Thus, employee job satisfaction cannot be built solely through job crafting or innovation but must be supported by organizational support and employee engagement. Keywords: Employee Engagement; Innovative Work Behavior; Job Crafting; Job Satisfaction; Organizational Support","https://openalex.org/W7107862255","yes"
"Antecedents and Outcomes of Digital Leadership: A Systematic Literature Review","Khawar Hussain, Hina Shahab, Sahiba Anwer","2026","https://doi.org/10.53909/rms.08.01.0334","article","Reviews of Management Sciences","Purpose This research qualitatively synthesizes the literature and examines the antecedents and consequences of digital leadership. It provides a conceptual map of digital leadership that links research-based theoretical development to pragmatic application in digital transformation. Design/methodology/approach This review integrates findings from 26 peer-reviewed articles to examine digital leadership. It focuses on qualitative synthesis to examine the antecedents, mediators, moderators, and consequences of digital leadership. Findings Digital leadership extends e-leadership by strategically using technology to drive organizational change and system redesign. It is shaped by factors such as market orientation, digital culture, organizational learning, and network capability, which enhance innovation and transformation readiness. It improves employee performance, innovation capacity, and financial outcomes. Moderators like IT integration, big data analytics capability, and psychological capital influence its effectiveness. Unlike traditional leadership, it embeds technology into strategies to sustain dynamic capabilities in complex environments. Conclusion However, some scholars identify certain levels of confusion about the concepts of digital leadership and e-leadership. The authors are supposed to analyze external and psychological factors, as well as qualitative approaches, to enhance understanding and improve practice. Moreover, this paper presents future research directions and extends the existing knowledge base by identifying the potential antecedents and consequences of digital leadership.","https://openalex.org/W7134239118","yes"
