title,authors,year,doi,type,source,abstract,openalex_id,open_access
"The Effects of Capability and Social Interaction on Job Performance, with Organizational Citizenship Behavior as a Moderasi a Study at the Islamic Hospital in Magelang City","Aditya Angger Wibowo","2026","https://doi.org/10.61132/epaperbisnis.v3i1.700","article","Epaper Bisnis.","This study aims to investigate the determinants of job performance by integrating the variables of capability, social interaction, and Organizational Citizenship Behavior (OCB) as a moderating variable. The phenomenon of employee turnover and discrepancies in staff discretionary behavior within the hospital setting serves as the primary rationale for this study. Using a quantitative approach, data were collected from 240 respondents at Magelang City Islamic Hospital through purposive sampling. Data analysis was conducted using Structural Equation Modeling (SEM) based on AMOS software to test the causal relationships among variables in the structural model. The research findings provide empirical confirmation that individual capabilities and the quality of social inter-actions have a positive and significant influence on stimulating the formation of OCB. Furthermore, statistical test results demonstrate that capabilities, social interactions, and OCB simultaneously make a significant contribution to improving employee work performance. The presence of OCB is identified as a crucial factor capable of strengthening organizational performance outcomes. The practical implications of this study emphasize the need for hospital management to formulate human resource development strategies focused on strengthening technical skills and social cohesion to mit-igate the impact of turnover and accelerate the sustainable performance of healthcare services.","https://openalex.org/W7155645081","yes"
"BENEVOLENT LEADERSHIP AND RESILIENCE IN DRIVING INNOVATIVE WORK BEHAVIOR: ROLE OF AN INNOVATIVE CLIMATE","Asep Gunawan, Siti Gartini, Dadang Priyono","2026","https://doi.org/10.23969/jrbm.v19i1.34213","article","Jurnal Riset Bisnis dan Manajemen","Innovation is essential for maintaining competitiveness in Indonesia's swiftly changing smartphone sector. Drawing on Social Exchange Theory (SET) and Conservation of Resources (COR) Theory, this study examines how benevolent leadership and employee resilience relate to innovative work behavior (IWB), with innovative climate conceptualized as a boundary condition. Using PLS-SEM on survey data from 221 employees of PT. Zhi Sheng Indonesia, the findings show that benevolent leadership and employee resilience do not exert significant direct effects on IWB. Instead, an innovative climate is positively associated with IWB and significantly moderates the relationship between benevolent leadership and innovative work behavior. These results indicate that benevolent leadership contributes to innovation primarily when embedded in an innovation-supportive climate that legitimizes experimentation and reduces perceived risk. The study extends SET and COR by demonstrating that relational and personal resources are necessary but insufficient for innovation without contextual activation.","https://openalex.org/W7131356246","yes"
"How to Realize Business Model Innovation for New Ventures? Psychological Capital and Social Capital Perspective","Jian Zhou, Yubo Liu, Peng Yang et al.","2022","https://doi.org/10.3389/fpsyg.2022.707282","article","Frontiers in Psychology","Business model innovation has become a necessary means for enterprises to break through path constraints, achieve sustainable development, and obtain sustainable competitiveness, which has been paid more and more attention by entrepreneurs and scholars. Based on the resource conversation theory and signal theory, this study constructs a research model with psychological capital (PC) and social capital (SC) as independent variables and business model innovation as dependent variables along the logical path of ""resource acquisition-resource utilization."" By dividing business model innovation into pioneering business model innovation and perfect business model innovation, we use fuzzy-set qualitative comparative analysis (fsQCA) to explore the impact of dual capital on business model innovation of new ventures. This study takes entrepreneurs from the eastern part of China's seven entrepreneurship active provinces as investigation objects, based on the analysis of the collected 242 valid questionnaire results, emphasizing that any single antecedent can not be a sufficient and necessary condition for pioneering and perfect business model innovation. In this case, we carried out research with a certain antecedent variable as the core and supplemented with other antecedent variables to form seven different configurations. The results showed that the combination of the antecedent variables could effectively achieve the pioneering and perfect business model innovation. The theoretical contributions of this study are as follows: (1) it enriches the research on the antecedents of business model innovation in new ventures; (2) it expands the application scenarios of resource conversation theory and signal theory; and (3) it is emphasized that the innovation of business model of new ventures is the result of the interaction and value-added linkage of various internal and external resources.","https://openalex.org/W4282576068","yes"
"Are lean and digital engaging better problem solvers? An empirical study on Italian manufacturing firms","Ambra Galeazzo, Andrea Furlan, Diletta Tosetto et al.","2024","https://doi.org/10.1108/ijopm-06-2023-0477","article","International Journal of Operations & Production Management","Purpose We studied the relationship between job engagement and systematic problem solving (SPS) among shop-floor employees and how lean production (LP) and Internet of Things (IoT) systems moderate this relationship. Design/methodology/approach We collected data from a sample of 440 shop floor workers in 101 manufacturing work units across 33 plants. Because our data is nested, we employed a series of multilevel regression models to test the hypotheses. The application of IoT systems within work units was evaluated by our research team through direct observations from on-site visits. Findings Our findings indicate a positive association between job engagement and SPS. Additionally, we found that the adoption of lean bundles positively moderates this relationship, while, surprisingly, the adoption of IoT systems negatively moderates this relationship. Interestingly, we found that, when the adoption of IoT systems is complemented by a lean management system, workers tend to experience a higher effect on the SPS of their engagement. Research limitations/implications One limitation of this research is the reliance on the self-reported data collected from both workers (job engagement, SPS and control variables) and supervisors (lean bundles). Furthermore, our study was conducted in a specific country, Italy, which might have limitations on the generalizability of the results since cross-cultural differences in job engagement and SPS have been documented. Practical implications Our findings highlight that employees’ strong engagement in SPS behaviors is shaped by the managerial and technological systems implemented on the shop floor. Specifically, we point out that implementing IoT systems without the appropriate managerial practices can pose challenges to fostering employee engagement and SPS. Originality/value This paper provides new insights on how lean and new technologies contribute to the development of learning-to-learn capabilities at the individual level by empirically analyzing the moderating effects of IoT systems and LP on the relationship between job engagement and SPS.","https://openalex.org/W4393115210","yes"
"Managing work-life balance among elementary school teachers in the era of digital education: Challenges and strategies","Agnes Joy Sumagit","2025","https://doi.org/10.62025/dwijmh.v4i3.160","article","Divine Word International Journal of Management and Humanities (DWIJMH) (ISSN 2980-4817)","This study determined the challenges and strategies of elementary school teachers in rural schools within the Schools Division of Ilocos Sur in managing work-life balance in the era of digital education. Using descriptive phenomenology, the lived experiences of elementary school teachers were explored through online open-ended interview questionnaires. Thematic analysis revealed several key challenges: blurred boundaries between work and personal life, psychological and emotional stress, technological difficulties, and excessive workload. In response, teachers adopted coping strategies such as effective time management, ssetting bboundaries bbetween work and personal life, seeking family support, and practicing self-care and stress management aactivities. The findings underscore the urgent need for policy interventions and institutional support systems that promote sustainable digital teaching practices while safeguarding the holistic welfare of educators.","https://openalex.org/W4414622322","yes"
"It's here to stay: Lessons, reflections, and visions on digital transformation amid public crisis","Guojun Sawyer He, Thi Thanh Huong Tran, Leonidas C. Leonidou","2024","https://doi.org/10.1016/j.techfore.2024.123557","article","Technological Forecasting and Social Change","","https://openalex.org/W4400366903","yes"
"The Role of Digital Transformation in Enhancing Employee Motivation and Organizational Efficiency: A Study of Enterprise Management Strategies","","2024","https://doi.org/10.7753/ijsea1310.1014","article","International Journal of Science and Engineering Applications","In today's fast-paced digital economy, enterprises are increasingly adopting digital transformation to stay competitive and improve operational efficiency.This paper explores the role of digital transformation in enhancing employee motivation and organizational efficiency through the lens of enterprise management strategies.By leveraging technology-driven changes, companies can streamline processes, foster innovation, and create a more dynamic work environment.However, the success of such initiatives largely depends on the alignment of digital tools with employee motivation and engagement.Through a mixed-methods approach, this study investigates how digital technologies, such as automation, artificial intelligence, and cloud computing, impact employee performance and morale.The research also delves into the strategies that managers can implement to bridge the gap between technological advancement and human resource development.Findings reveal that when digital transformation is paired with robust motivational strategies, it leads to improved productivity, higher employee satisfaction, and organizational growth.The study concludes with recommendations for enterprise managers to effectively integrate digital transformation while maintaining a motivated workforce.","https://openalex.org/W4402960960","yes"
"The Next-Generation Shopper: A Study of Generation-Z Perceptions of AI in Online Shopping","Ovidiu-Iulian Bunea, Răzvan-Andrei Corboș, Sorina Ioana Mișu et al.","2024","https://doi.org/10.3390/jtaer19040125","article","Journal of theoretical and applied electronic commerce research","This study explores the impact of artificial intelligence (AI) tools on the purchase intentions of members of Generation Z (Gen Z) in online shopping, using an adapted technology acceptance model (TAM). It incorporates exposure to AI, usage of AI, and knowledge about AI, alongside the existing TAM parameters of perceived usefulness of AI (PUAI) and perceived ease-of-use of AI (PEUAI). A 38-item questionnaire was distributed, yielding data from 1128 Gen Z respondents. Partial least squares structural equation modeling (PLS-SEM) and importance–performance analysis (IPA) were applied to examine the hypothesized relationships. The study identified significant direct effects of exposure, use, and knowledge on PUAI and PEUAI, and that these effects affected consumers’ purchase intentions. Indirect effects analysis revealed that PUAI and PEUAI mediate between AI exposure, use, knowledge, and purchase intentions, suggesting that greater understanding of and familiarity with AI enhance the propensity to engage in AI-powered online transactions. The ease of integrating AI into daily life and perceived AI utility enhance purchase intentions. The study offers insights for online retailers leveraging AI technologies in an effort to enhance consumer purchase experiences, emphasizing the potential of AI to positively influence choices while enhancing trust, familiarity, and the overall user experience.","https://openalex.org/W4402965902","yes"
"Digitalization and Employee Health and Well-Being During COVID-19","Hyesong Ha, Aarthi Raghavan, Mehmet Akif Demircioğlu et al.","2026","https://doi.org/10.3390/admsci16030156","article","Administrative Sciences","Employees were required to adopt new working methods within a very short time frame during the COVID-19 period through digitalization. While digitalization has been largely perceived as an enabler during the pandemic, its impact on employee health and well-being remains complex and underexplored, particularly in the public sector, where employees have less discretion to adapt digital tools. This study examines how rapid workplace digitalization during COVID-19 affected employee health and well-being in the public sector. Drawing on the job demands–resources (JD-R) framework, we focus on three specific forms of digital work—digital meetings, digital clearance, and digital training—selected because they represent distinct theoretical pathways through which digitalization affects well-being, such as digital meetings and digital training can increase job demands that can deplete employee energy and increase stress, whereas digital clearance operates as a job resource that reduces bureaucratic hurdles and enhances autonomy. To test these ideas, this study uses data from the 2020 Australian Public Service Commission Census (n = 108,085), and applies ordinal and multinomial generalized structural equation modeling (GSEM) to assess the effects of three new ways of working—digital meetings, digital clearance, and digital training—on employees’ health and well-being, as well as the mediating roles of organizational support. The results demonstrate that while digital clearance is positively associated with employee health and well-being, digital meetings and digital training are negatively associated. Organizational support mediates these relationships, underscoring its importance in mitigating adverse effects. These findings highlight the mixed consequences of digitalization for public employees’ health and well-being and point to the need for supportive organizational strategies in times of crisis. As a practical implication, this study suggests that public sector organizations should prioritize employee mental health in teleworking policies, adopt employee-centered digital transformation strategies that provide adequate resources and training support, and implement digital clearance processes that enhance employee well-being, particularly during a crisis.","https://openalex.org/W7139051473","yes"
"Exploring Opportunities for Artificial Intelligence in Organization Development","Sunyoung Park, Dae Seok Chai, Jennifer Jihae Park et al.","2024","https://doi.org/10.1177/15344843241273231","article","Human Resource Development Review","The purpose of this research was to examine the utilization of artificial intelligence (AI) in organization development (OD) through a comprehensive review of existing literature. We also propose potential avenues for future research on AI in OD. We conducted a systematic literature review of 68 studies on AI in OD based on Cummings and Worley’s four OD categories (i.e., human process, human resource, strategic change, and technostructural interventions). We first summarized and analyzed key information about how AI is implemented in OD contexts, and then examined the underlying theories or theoretical frameworks utilized in OD studies focusing on AI. We examined the application of AI in OD, potential ethical concerns, and recommendations for future research and practice using AI in OD. The paper concludes with discussion and implications for research and practice.","https://openalex.org/W4401772783","yes"
"The effects of new ways of working (NWW) on employees’ well-being and happiness. A theoretical overview","Ángeles López Cabarcos, Analía López‐Carballeira, Carlos Ferro‐Soto","2025","https://doi.org/10.7200/esicm.56.341","article","ESIC MARKET Economic and Business Journal","Purpose: New ways of working (NWW) is an emerging trend in contemporary organisations, driven by the need to be flexible and adapt quickly to changes. Thus, NWW provides employees with greater control over their working time, also increasing their autonomy with the support of ICTs. However, the adoption of flexible work arrangements can be a source of a wide range of concerns, which can influence employees’ well-being and happiness at work. This research aims to develop an overall framework to guide future research on new flexible work models. Methodology: This theoretical overview proposes to analyse the influence of e-demands (technostress, e-work-life balance, etc.) resulting from NWW adoption on employees’ e-well-being (e-psychological well-being, e-emotional exhaustion, etc.) and e-happiness. To mitigate the potential negative effects of NWW practices, both organisations and employees should identify personal e-resources (e-psychological capital, e-work self-efficacy, e-psychological empowerment) and job e-resources (e-engaging leadership, e-work effectiveness) that can serve as effective moderators to promote employees’ well-being. Results: The proposed model attempts to provide an overview based on available knowledge about the relationships between e-demands, employees’ e-well-being and personal and job resources in e-work contexts. Practical implications: This research aims to shed light on the need for effective strategies to adapt the NWW to work environments characterised by higher levels of flexibility and the intensive use of ICTs, with the aim of guaranteeing employees’ well-being, health and happiness, and achieving better results.","https://openalex.org/W4406759231","yes"
"Optimizing Nursing Productivity: Exploring the Role of Artificial Intelligence, Technology Integration, Competencies, and Leadership","Atallah Alenezi, Mohammed Hamdan Alshammari, Ibrahim Abdullatif Ibrahim","2024","https://doi.org/10.1155/2024/8371068","article","Journal of Nursing Management","Background: In the rapidly evolving healthcare management landscape, technology integration and artificial intelligence utilization play pivotal roles in shaping employee productivity. This research investigates these dynamics within Riyadh Province, Kingdom of Saudi Arabia, focusing on the relationships between technology integration, the use of artificial intelligence in nursing profession, nursing workforce competencies, technological leadership, and employee productivity. Methods: A quantitative approach was employed, involving 329 nurses from five hospitals in Riyadh Province. Partial Least Squares Structural Equation Modeling facilitated comprehensive analysis of direct and indirect relationships among variables. Results: Findings reveal that technology integration significantly enhances nursing productivity, while the use of artificial intelligence initially presents disruptions before yielding productivity gains. Nursing workforce competencies mediate these relationships, emphasizing the critical role of workforce readiness in harnessing technology's benefits. Surprisingly, technological leadership did not significantly moderate these effects. Conclusions: This research offers vital insights for healthcare organizations, advocating strategic technology integration and workforce development. It underscores the significance of nursing competencies in navigating technological transformations and affirms the enduring importance of leadership in guiding these changes. As healthcare evolves, these findings provide guidance for optimizing technology and artificial intelligence to enhance employee productivity and patient care.","https://openalex.org/W4400037209","yes"
"When Companies Make Your Day","Aurélie Dudézert, Florence Laval, Anuragini Shirish et al.","2023","https://doi.org/10.4018/jgim.322386","article","Journal of Global Information Management","Pre-digital organizations were established before the digital and collaborative economy. Faced with this new economy, they are carrying out organizational transformation projects that involve significant changes in tasks, working conditions, and employee well-being. A positive emotional climate can support these digital transformations. Companies have therefore developed specific change management practices focusing on happiness at work to support these digital transformation programs of work practices. This research explores the role of happiness management as a change management practice for digital transformation. Using a multiple case study method, it illustrates how happiness management practices are enacted in three French pre-digital organizations from different industries. It identifies characteristics of happiness management mobilized differently by each organization. Some combinations of these characteristics and employees' control perceptions are shown to lead to a positive emotional climate which in turn affects the success of digital workplace transformations.","https://openalex.org/W4367060197","yes"
"A study on the blended learning effects on students majoring in preschool education in the post-pandemic era: An example of a research-method course in a Chinese university","Weiguaju Nong, Jian‐Hong Ye, Pengfei Chen et al.","2023","https://doi.org/10.3389/fpsyg.2022.962707","article","Frontiers in Psychology","The world has gradually entered the post-pandemic era. Although the pandemic has been slowing down, it still has a strong impact on the education scene. Thus, how to provide students with an effective and flexible learning style is currently an important educational issue. This study focused on the implementation of effective teaching to improve the learning effects based on these special circumstances. To ensure a realistic teaching situation, an experiment of blended learning was conducted in a university in the Guangxi Zhuang Autonomous Region of China for a short-term study, based on the consideration of pandemic supervision and control. In this experiment, a single-group quasi-experimental design method, using the extended O-PIRTATD/S model, was adopted in a research-method course designed for students majoring in preschool education. This research-method course was an 8-week flipped course, where the first 4 weeks were online teaching and the last 4 weeks were taught offline, thus combining as a blended learning course. A total of 115 active participants were recruited for this study. Based on the theoretical framework of the belief-action-outcome (BAO) model, five research hypotheses were proposed with the aim of constructing a learning behavior pattern based on cognitive beliefs which could be verified by structural equation modeling. The results of the study were concluded as follows: 1. Academic self-efficacy had a positive impact on learning engagement, but had a negative impact on cognitive load; 2. Cognitive load did not have a significant impact on learning engagement; 3. Learning engagement had a positive impact on the enhancement of academic self-confidence; and 4. Cognitive load had a negative impact on the enhancement of academic self-confidence.","https://openalex.org/W4315649730","yes"
"Thriving in future work: knowledge management and innovation perspectives","Zhou Jiang, Meng‐Long Huo, Janice Jones et al.","2024","https://doi.org/10.1080/14778238.2024.2344347","article","Knowledge Management Research & Practice","The future of work and business is undergoing rapid transformation, driven by dynamic shifts in technology, the economy, climate, and demographics.Scholars emphasise the necessity for proactive adaptation to these changes to ensure the thriving of both individuals and organisations in future business landscapes.Recent research has increasingly underscored the crucial role of knowledge in fostering both individual growth and organisational innovation.Particularly, innovative knowledge is deemed essential for future success, as it can enable individuals and organisations to navigate complex environments effectively.However, gaps persist in understanding how knowledge, especially innovative knowledge, can be harnessed effectively to benefit stakeholders.This raises the need for deeper insights into its implications for individual and organisational thriving in the future of work.In this piece of writing, we showcase a series of studies that aim to theoretically and empirically address the intersection of knowledge, innovation, technology, thriving, and careers.By doing so, our intention is to ignite continued scholarly interest in enriching our understanding of how to facilitate thriving and effective individuals and organisations through a knowledge-driven approach, and consequently to spark new ways of thinking to tackle future challenges.","https://openalex.org/W4395006527","yes"
